{
  "$schema": "https://json-schema.org/draft/2020-12/schema",
  "$id": "https://sibylhub.com/schema/ecosystem/2.0/index",
  "title": "SibylHub normalized ecosystem index",
  "type": "object",
  "required": [
    "schemaVersion",
    "revisionId",
    "languages",
    "builders"
  ],
  "properties": {
    "schemaVersion": {
      "const": "2.0"
    },
    "revisionId": {
      "type": "string",
      "pattern": "^sha256:[0-9a-f]{64}$"
    },
    "languages": {
      "type": "array",
      "minItems": 25,
      "maxItems": 25,
      "items": {
        "type": "object",
        "required": [
          "id",
          "slug",
          "name",
          "path"
        ],
        "properties": {
          "id": {
            "type": "string",
            "minLength": 1
          },
          "slug": {
            "type": "string",
            "minLength": 1
          },
          "name": {
            "type": "string",
            "minLength": 1
          },
          "path": {
            "type": "string",
            "pattern": "^languages/[a-z0-9][a-z0-9-]*\\.json$"
          }
        },
        "additionalProperties": false
      }
    },
    "builders": {
      "type": "array",
      "items": {
        "type": "object",
        "required": [
          "id",
          "slug",
          "name"
        ],
        "properties": {
          "id": {
            "type": "string",
            "minLength": 1
          },
          "slug": {
            "type": "string",
            "minLength": 1
          },
          "name": {
            "type": "string",
            "minLength": 1
          }
        },
        "additionalProperties": false
      }
    }
  },
  "additionalProperties": false
}
